Titre,URL
Déclaration TVA mensuelle relative à décembre 202520.01.2026,https://compta.webwin.be/calendar/declaration-tva-mensuelle-relative-a-decembre-2025
TVA - Relevé intracommunautaire mensuel20.01.2026,https://compta.webwin.be/calendar/tva-releve-intracommunautaire-mensuel-3
"Réduction d'impôt pour les dons : encore de 30% (auparavant : 45%).Impôts des personnes physiquesSi vous faites un don à une organisation agréée, vous pouvez, sous certaines conditions, obtenir une réduction d’impôt à l'IPP. Le don doit s’élever à au moins 40 € et vous devez disposer d’une attestation délivrée par l’organisation agréée à laquelle vous faites le don.16.01.2026",https://compta.webwin.be/newsletter-by-email/reduction-dimpot-pour-les-dons-encore-de-30-auparavant-45
"Depuis le 1er janvier 2026, l’« héritage entre amis » flamand a été remplacé par la « réduction pour célibataires »Impôts - Héritage et donationsAvec l’« héritage entre amis », vous pouviez, depuis le 1er juillet 2021 en Flandre, léguer par testament jusqu’à 15.000 € à un ou plusieurs amis ou parents plus éloignés (frères/sœurs et autres parents) à un taux réduit de 3 % au lieu de 25 %.  Ce régime a désormais disparu et a été remplacé par la réduction dite « pour célibataires », qui est uniquement destinée aux testateurs célibataires sans enfants ni petits‑enfants16.01.2026",https://compta.webwin.be/new-flashes/depuis-le-1er-janvier-2026-l-heritage-entre-amis-flamand-a-ete-remplace-par-la-reduction-pour-celibataires
"Règles plus strictes pour les droits d’enregistrement de 2 % sur votre habitation propre et unique en FlandreSi vous achetez en Flandre un logement qui est votre habitation familiale propre et unique, vous ne payez que 2 % de droits d’enregistrement, mais depuis le 1er janvier 2026, il est beaucoup plus difficile de conserver cet avantage.15.01.2026",https://compta.webwin.be/newsletter-by-email/regles-plus-strictes-pour-les-droits-denregistrement-de-2-sur-votre-habitation-propre-et-unique-en-flandre
"Titres-services à Bruxelles à partir de 2026 : qu’est-ce qui change pour vous ?Impôts des personnes physiquesDepuis le 1er janvier 2026, le système bruxellois des titres-services a été modifié. L'objectif est de mieux valoriser le travail des aides ménagères.15.01.2026",https://compta.webwin.be/new-flashes/titres-services-a-bruxelles-a-partir-de-2026-quest-ce-qui-change-pour-vous
"Indemnité kilométrique légèrement indexée depuis le 01.01.2026Impôt des sociétés, Impôts des personnes physiquesSi un dirigeant d'entreprise ou un employé effectue des déplacements professionnels avec sa propre voiture, moto ou mobylette, il peut recevoir une indemnité forfaitaire de la part, respectivement, de sa société ou de son employeur.09.01.2026",https://compta.webwin.be/new-flashes/indemnite-kilometrique-legerement-indexee-depuis-le-01012026
"La déduction des intérêts hypothécaires pour un logement qui n’est pas l’habitation propre est supprimée à partir de l’exercice d’imposition 2026Impôts des personnes physiquesDepuis l’exercice d’imposition 2026 (revenus 2025), la déduction des intérêts pour les prêts en personne physique contractés pour un bien qui n’est pas l’habitation propre a été supprimée. Il s’agit de prêts que vous avez contractés en personne physique pour l’achat ou la rénovation, par exemple, d’un logement mis en location ou d’une seconde résidence.08.01.2026",https://compta.webwin.be/newsletter-by-email/la-deduction-des-interets-hypothecaires-pour-un-logement-qui-nest-pas-lhabitation-propre-est-supprimee-a-partir-de-lexercice-dimposition-2026
"Taux réduit de TVA de 6% pour les pompes à chaleur (à compter du 1er janvier 2026)Impôts - TVAJusqu’à fin 2024, le taux de TVA réduit de 6 % pouvait être appliqué à l’installation de pompes à chaleur dans des logements privés de moins de 10 ans. Ce régime a désormais été réintroduit depuis le 01.01.2026 et ce pour une période de 5 ans.08.01.2026",https://compta.webwin.be/newsletter-by-email/taux-reduit-de-tva-de-6-pour-les-pompes-a-chaleur-a-compter-du-1er-janvier-2026
"Il se peut que vos versements anticipés ne soient pas visibles sur MyMinfinImpôt des sociétés, Impôts des personnes physiquesLe SPF Finances a fait savoir que  certains versements anticipés ne sont temporairement pas visibles sur MyMinfin.07.01.2026",https://compta.webwin.be/new-flashes/il-se-peut-que-vos-versements-anticipes-ne-soient-pas-visibles-sur-myminfin
"Vente d’actions : pourquoi vaut-il mieux convenir de dispositions en matière de paiement ?Impôt des sociétésVous possédez une entreprise et avez vendu un important paquet d’actions à votre fils. Plusieurs années plus tard, un différend surgit, parce que le paiement n’a pas été effectué. Vous vous demandez si votre créance est prescrite, et ce que vous pouvez faire.22.12.2025",https://compta.webwin.be/tax-dosier-of-the-month/vente-dactions-pourquoi-vaut-il-mieux-convenir-de-dispositions-en-matiere-de-paiement
"Un smartphone comme cadeau de Noël de votre société?Impôt des sociétés, Impôts des personnes physiquesUne SRL peut acheter un smartphone que vous utiliserez tant à des fins professionnelles que privées.18.12.2025",https://compta.webwin.be/newsletter-by-email/un-smartphone-comme-cadeau-de-noel-de-votre-societe
"Pas de majoration d'impôt de 10% sur les impositions d'avant le 29 juillet 2025?Impôt des sociétés, Impôts des personnes physiquesComme déjà communiqué précédemment, une première erreur commise de bonne foi ne sera plus sanctionnée par une majoration d’impôt de 10 % pour les impositions enrôlées depuis le 29 juillet 2025.18.12.2025",https://compta.webwin.be/new-flashes/pas-de-majoration-dimpot-de-10-sur-les-impositions-davant-le-29-juillet-2025
"Encore investir à la fin de l'année via votre société?Impôt des sociétésSi votre bénéfice pour 2025 est plus élevé que prévu, il peut sembler logique d’effectuer encore en 2025 un investissement prévu pour 2026, mais ce n’est pas toujours aussi intéressant fiscalement.18.12.2025",https://compta.webwin.be/newsletter-by-email/encore-investir-a-la-fin-de-lannee-via-votre-societe
"Réception de fin d'année pour les clientsImpôts - TVA, Impôt des sociétésAller dîner au restaurant avec un client pour le Nouvel An ou plutôt organiser une réception de fin d’année avec un service traiteur ? Pour le fisc, ce n’est pas la même chose : les frais de restaurant et les frais de réception sont traités différemment, tant en impôts sur les revenus qu’en TVA.18.12.2025",https://compta.webwin.be/new-flashes/reception-de-fin-dannee-pour-les-clients
"Retirer de l’argent de votre société via l’octroi de dividendesImpôt des sociétésUn dividende, c’est la rémunération accordée à l’actionnaire pour ses « apports » en argent ou en nature.18.12.2025",https://compta.webwin.be/monthly-ligthing-on/retirer-de-largent-de-votre-societe-via-loctroi-de-dividendes
"La majoration tarifaire pour dépôt tardif des comptes annuels est indexée à compter du 01.01.2026Impôt des sociétésEn principe, les comptes annuels d’une société doivent être déposés auprès de la Banque nationale de Belgique dans les 30 jours suivant leur approbation par l’assemblée générale et au plus tard sept mois après la date de clôture de l’exercice.14.12.2025",https://compta.webwin.be/newsletter-by-email/la-majoration-tarifaire-pour-depot-tardif-des-comptes-annuels-est-indexee-a-compter-du-01012026
"SCE 2.0 : nouvelle tolérance jusqu'au 31.03.2026Impôts - TVAPour les (nouveaux) établissements horeca qui doivent utiliser un système de caisse enregistreuse (SCE) mais n’en disposent pas encore, l’installation obligatoire du nouveau SCE 2.0 est à nouveau reportée.  Cette obligation avait déjà été reportée au 1er janvier 2026, mais la tolérance est désormais prolongée jusqu’au 31 mars 2026.14.12.2025",https://compta.webwin.be/new-flashes/sce-20-nouvelle-tolerance-jusquau-31032026
"Echéances à l'impôt des sociétés en cas d'exercice comptable décaléImpôt des sociétésSi votre exercice comptable ne se termine pas le 31 décembre, vous avez un exercice décalé. Pour un exercice décalé, l’exercice d’imposition est l’année civile au cours de laquelle l’exercice se clôture; si votre exercice se termine le 30 septembre 2025, l’exercice d’imposition est 2025.11.12.2025",https://compta.webwin.be/newsletter-by-email/echeances-a-limpot-des-societes-en-cas-dexercice-comptable-decale
"Tarif remboursement de l'électricité utilisée pour la recharge à domicile pour le Q1/2026Impôts des personnes physiquesSi vous recevez une indemnité de votre société/employeur pour la recharge à domicile du véhicule de société électrique, vous êtes en principe imposé sur un avantage de toute nature à l'IPP.11.12.2025",https://compta.webwin.be/new-flashes/tarif-remboursement-de-lelectricite-utilisee-pour-la-recharge-a-domicile-pour-le-q12026
"Droits de vente réduits en Wallonie : nouveaux montants pour 2026En Région wallonne, vous pouvez bénéficier d’un droit d’enregistrement réduit de 6% au lieu de 12,5 % pour l’achat de petites propriétés rurales (biens immeubles destinés ou utilisés pour l’exploitation agricole).05.12.2025",https://compta.webwin.be/newsletter-by-email/droits-de-vente-reduits-en-wallonie-nouveaux-montants-pour-2026
"Les comptes de l'État belge déménagent : pas de virements du 12 au décembre 2025Impôt des sociétés, Impôts des personnes physiquesBNP Paribas Fortis reprendra, le week-end des 13 et 14 décembre 2025, les comptes de l’État fédéral (les comptes sur lesquels vous payez par exemple des amendes routières ou versez votre précompte professionnel mensuel) à Bpost.05.12.2025",https://compta.webwin.be/new-flashes/les-comptes-de-letat-belge-demenagent-pas-de-virements-du-12-au-decembre-2025
"Facturation électronique obligatoire : tolérance pendant les 3 premiers mois de 2026Impôts - TVAÀ partir du 1er janvier 2026, les entreprises belges assujetties à la TVA doivent s’envoyer entre elles (B2B) des factures électroniques via le réseau Peppol.05.12.2025",https://compta.webwin.be/new-flashes/facturation-electronique-obligatoire-tolerance-pendant-les-3-premiers-mois-de-2026
"Versements anticipés : extraits erronés reçus le 26 novembre, aucune démarche à faire!Impôt des sociétés, Impôts des personnes physiquesLe SPF Finances informe qu’il a envoyé des extraits incomplets des versements anticipés via MyMinfin le mercredi 26 novembre.02.12.2025",https://compta.webwin.be/newsletter-by-email/versements-anticipes-extraits-errones-recus-le-26-novembre-aucune-demarche-a-faire
Comment traiter un compte courant en cas de divorce ?Impôt des sociétésQuel conjoint doit régler (ou se voir attribuer) le compte courant (C/C) en cas de divorce ? Et qu’advient-il en cas d’augmentation ou de diminution de ce compte pendant la procédure de divorce ?30.11.2025,https://compta.webwin.be/tax-dosier-of-the-month/comment-traiter-un-compte-courant-en-cas-de-divorce
"Retirer de l’argent de votre société via un prélèvement en compte courantImpôts - TVA, Impôt des sociétés, Impôts des personnes physiquesUn prélèvement en compte courant signifie que vous prélevez des liquidités dans la caisse de votre société à des fins privées, sans considérer ce prélèvement p.ex. comme une rémunération ou une indemnité de frais30.11.2025",https://compta.webwin.be/monthly-ligthing-on/retirer-de-largent-de-votre-societe-via-un-prelevement-en-compte-courant
"Accorder une réduction au personnel, mais dans certaines limitesSocial, Impôt des sociétés, Impôts des personnes physiquesAccorder une réduction au personnel signifie que les travailleurs peuvent acheter vos produits ou services à prix réduit.28.11.2025",https://compta.webwin.be/newsletter-by-email/accorder-une-reduction-au-personnel-mais-dans-certaines-limites
"Encore investir en fin d'année via votre entreprise unipersonnelle?Impôts des personnes physiquesVos bénéfices pour 2025 s’annoncent-ils plus élevés que prévu ? Dans ce cas, il peut être intéressant d’effectuer encore 2025, via votre entreprise individuelle, un investissement que vous aviez prévu pour 2026.28.11.2025",https://compta.webwin.be/new-flashes/encore-investir-en-fin-dannee-via-votre-entreprise-unipersonnelle
"Déduction TVA d’un achat effectué dans le passéImpôts - TVASi vous ne devenez assujetti à la TVA qu’après avoir acheté un bien, la TVA sur cet achat n’est en principe plus déductible, pas même partiellement. Si, au moment de l’achat, vous étiez assujetti à la TVA et que vous utilisiez le bien à des fins privées, vous pouvez récupérer ultérieurement une partie de la TVA due à l’achat une fois que l’usage professionnel débute.27.11.2025",https://compta.webwin.be/newsletter-by-email/deduction-tva-dun-achat-effectue-dans-le-passe
"Restaurant le soir/week-end déductible?Impôts - TVA, Impôt des sociétés, Impôts des personnes physiquesLes frais de restaurant avec des clients sont considérés comme des frais professionnels et sont déductibles à concurrence de 69 % à l’impôt sur les revenus (art. 53, 8bis° CIR 92). Vous devez toutefois démontrer qu’il s’agit de repas d’affaires et non d’une visite privée.27.11.2025",https://compta.webwin.be/new-flashes/restaurant-le-soirweek-end-deductibles
Cotisation à charge des sociétés 2025 : à payer pour le 31.12.2025 au plus tardSocialLa cotisation à charge des sociétés est la cotisation annuelle que votre société doit payer à la caisse d’assurances sociales. Elle est fiscalement déductible en tant que frais professionnels.21.11.2025,https://compta.webwin.be/new-flashes/cotisation-a-charge-des-societes-2025-a-payer-pour-le-31122025-au-plus-tard
"Frais de bureau à domicile comme frais professionnels?Impôt des sociétés, Impôts des personnes physiquesEn tant que dirigeant d’entreprise, utilisez-vous une partie de votre habitation comme bureau pour votre société ? Dans ce cas, au lieu de la louer à votre société ou de faire verser par votre société une indemnité de frais à cet effet, vous pouvez déduire ces frais de votre rémunération.21.11.2025",https://compta.webwin.be/new-flashes/frais-de-bureau-a-domicile-comme-frais-professionnels
"Dès 2026, plus d'exonération de la TMC pour les nouveaux véhicules électriques en FlandreImpôt des sociétés, Impôts des personnes physiquesÀ partir du 1er janvier 2026, en Flandre, l’exonération de la taxe de mise en circulation (TMC) et de la taxe de circulation annuelle disparaît pour les voitures électriques et à hydrogène nouvellement immatriculées. Ceux qui immatriculent avant cette date conservent l’exonération.21.11.2025",https://compta.webwin.be/newsletter-by-email/des-2026-plus-dexoneration-de-la-tmc-pour-les-nouveaux-vehicules-electriques-en-flandre
"Majoration d'impôt possible si déclaration en retardImpôt des sociétés, Impôts des personnes physiquesDepuis le 29 juillet 2025, vous ne recevez en principe plus de majoration d’impôt pour une première infraction si vous avez agi de bonne foi; cette bonne foi est en outre présumée.21.11.2025",https://compta.webwin.be/newsletter-by-email/majoration-dimpot-possible-si-declaration-en-retard
Démolition et reconstruction à 6% de TVA : formulaires disponibles !Impôts - TVALe régime permanent permettant de bénéficier du taux réduit de 6% de TVA en cas de démolition et reconstruction est entré en vigueur le 1er juillet 2025.14.11.2025,https://compta.webwin.be/new-flashes/demolition-et-reconstruction-a-6-de-tva-formulaires-disponibles
Taxe communale : votre lieu de résidence au 1er janvier détermine le montant que vous payezImpôts des personnes physiquesLa taxe communale varie d'une commune à l'autre et est redéfinie chaque année. Votre lieu de résidence officiel au 1er janvier de l'exercice d'imposition détermine le taux que vous payez.14.11.2025,https://compta.webwin.be/newsletter-by-email/taxe-communale-votre-lieu-de-residence-au-1er-janvier-determine-le-montant-que-vous-payez
"Cadeau de fin d'année pour vos travailleurs inétressants fiscalementImpôt des sociétés, Impôts des personnes physiquesAvec la fin de l’année qui approche, vous pouvez faure plaisir à vos travailleurs vec un cadeau allant jusqu’à 40 € sans devoir payer d’impôts ou de cotisations sociales sur ce montant.14.11.2025",https://compta.webwin.be/newsletter-by-email/cadeau-de-fin-dannee-pour-vos-travailleurs-inetressants-fiscalement
"Exemption des droits de succession sur le logement familial au sens largeImpôts - Héritage et donationsLorsque votre partenaire (conjoint ou cohabitant légal) décède, vous ne payez pas de droits de succession sur le logement familial en Belgique (Flandre, Bruxelles et Wallonie).14.11.2025",https://compta.webwin.be/new-flashes/exemption-des-droits-de-succession-sur-le-logement-familial-au-sens-large
"Facture papier reçue en 2026 : quid de la déduction de la TVA et de la déduction de frais ?Impôts - TVAÀ partir de 2026, les assujettis belges à la TVA devront obligatoirement transmettre leurs factures électroniques via le réseau Peppol. Si vous recevez quand même une facture papier ou une facture PDF de votre fournisseur, cela peut poser des problèmes pour la déduction de la TVA.07.11.2025",https://compta.webwin.be/new-flashes/facture-non-electronique-recue-en-2026-quid-de-la-deduction-de-la-tva-et-de-la-deduction-de-frais
"Encore acheter une voiture ""non électrique"" avec votre société en 2025?Impôt des sociétésEnvisagez-vous d’acheter, avec votre société, une voiture qui n’est pas entièrement électrique et de déduire les frais à l’impôt des sociétés ? Alors, il faut agir vite : seuls les véhicules pour lesquels le bon de commande est signé avant le 1er janvier 2026 continueront à être déductibles.07.11.2025",https://compta.webwin.be/newsletter-by-email/encore-acheter-une-voiture-non-electrique-avec-votre-societe-en-2025
"Donner en location votre logement à votre société et lui faire payer les travaux d'aménagementImpôt des sociétésEnvisagez-vous de louer une partie de votre habitation à votre société pour un usage professionnel, par exemple comme espace de bureau? Des travaux d’aménagement devant encore être réalisés, il peut être intéressant de faire supporter ces frais par votre société.07.11.2025",https://compta.webwin.be/newsletter-by-email/donner-en-location-votre-logement-a-votre-societe-et-lui-faire-payer-les-travaux-damenagement
"Assouplissement rétroactif des conditions relatives à l'indemnité journalière à l'étrangerImpôt des sociétés, Impôts des personnes physiquesDans une circulaire récente relative à l'indemnité journalière à l'étranger (Circ. 2025/C/70, 27.10.2025), les règles relatives à la durée du déplacement professionnel et au traitement des jours de départ et de retour ont été modifiées. Ces modifications s'appliquent rétroactivement à compter du 1er janvier 2025.06.11.2025",https://compta.webwin.be/new-flashes/assouplissement-retroactif-des-conditions-relatives-a-lindemnite-journaliere-a-letranger
"Documents du SPF Finances que par voie numérique pour les entreprises via e-Box EnterpriseImpôt des sociétés, Impôts des personnes physiquesÀ partir du 1er novembre 2025, les entreprises recevront leurs documents du SPF Finances uniquement par voie numérique dans leur e-Box Enterprise. Cette boîte aux lettres numérique sécurisée est spécialement destinée à la communication entre votre entreprise et les institutions publiques.31.10.2025",https://compta.webwin.be/new-flashes/que-des-documents-du-spf-finances-par-voie-numerique-pour-les-entreprises-via-e-box-enterprise
"Se débarrasser d’une dette en C/C sans remboursement : salaire, dividende ou réduction du capital ?Impôt des sociétésVous avez une dette importante sur votre compte courant (C/C). Vous aimeriez la liquider sans la rembourser effectivement, et de préférence avec le coût fiscal le plus bas possible. Quelles sont vos options ?31.10.2025",https://compta.webwin.be/tax-dosier-of-the-month/se-debarrasser-dune-dette-en-cc-sans-remboursement-salaire-dividende-ou-reduction-du-capital
"Messages suspects du SPF Finances? Attention!Impôts des personnes physiquesNous constatons à nouveau que de faux messages circulent par e-mail, téléphone, SMS ou WhatsApp, affirmant que votre déclaration à l'impôt des personnes physiques (IPP) n’a pas encore été introduite, que vous avez une dette ou, au contraire, que vous avez droit à un remboursement.30.10.2025",https://compta.webwin.be/newsletter-by-email/messages-suspects-du-spf-finances-attention
Déclaration IPP revenus spécifiques 2024 (EI 2025) : report au 07.11.2025!Impôts des personnes physiquesLe ministre des Finances Jan Jambon a annoncé le 29 octobre 2025 qu’un nouveau report est accordé pour les déclarations à l'impôt des personnes physiques (IPP) lorsqu’il y a des revenus spécifiques à déclarer.30.10.2025,https://compta.webwin.be/new-flashes/declaration-ipp-revenus-specifiques-2024-ei-2025-report-au-07112025
"Reprendre la voiture (amortie) de votre sociétéImpôt des sociétés, Impôts des personnes physiquesVotre société dispose d'une voiture qui, après 5 ans, est totalement amortie? Vous pouvez la reprendre pour vous, à titre personnel.30.10.2025",https://compta.webwin.be/newsletter-by-email/reprendre-la-voiture-amortie-de-votre-societe
"Versements anticipés par votre société pour le 22 décembre 2025?Impôt des sociétésUn versement anticipé, étant une avance sur l'impôt des sociétés finalement dû que votre société doit payer, n'est pas obligatoire.23.10.2025",https://compta.webwin.be/newsletter-by-email/versements-anticipes-par-votre-societe-pour-le-22-decembre-2025
"Remboursement d'impôt année de revenus 2024 et AERImpôts des personnes physiquesSi votre gestionnaire de dossier vous a informé que vous avez droit à un remboursement d’impôt pour votre déclaration à l’impôt des personnes physiques concernant l’année de revenus 2024 (exercice d’imposition 2025), vous vous demandez sûrement quand et comment ce remboursement aura lieu.23.10.2025",https://compta.webwin.be/new-flashes/remboursement-dimpot-annee-de-revenus-2024-et-aer
"Cadeaux de fin d’année fiscalement intéressants pour les partenaires commerciauxImpôt des sociétés, Impôts des personnes physiquesLes cadeaux de fin d’année offerts aux clients ne sont déductibles comme frais professionnels qu’à hauteur de 50 %, et la TVA n’est entièrement déductible que si vous restez dans les limites prévues.23.10.2025",https://compta.webwin.be/new-flashes/cadeaux-de-fin-dannee-fiscalement-interessants-pour-les-partenaires-commerciaux
"Location d’une maison de vacances : activité privée ou professionnelle ?Impôts des personnes physiquesLa location d’une maison de vacances n’est en général pas considérée comme une activité professionnelle, sauf si vous proposez des services supplémentaires.23.10.2025",https://compta.webwin.be/newsletter-by-email/location-dune-maison-de-vacances-activite-privee-ou-professionnelle
Épargne-pension : pourquoi verser davantage rapporte parfois moinsImpôts des personnes physiquesLes personnes qui versent plus de 1 050 € dans le cadre de l''épargne-pension en 2025 pourraient bénéficier d'un avantage fiscal moins important à l'IPP. Un versement plus élevé n'entraine ainsi pas automatiquement un avantage fiscal plus important.16.10.2025,https://compta.webwin.be/new-flashes/epargne-pension-pourquoi-verser-davantage-rapporte-parfois-moins
"Au restaurant avec votre personnel pour la Saint-Nicolas ou NoëlImpôts - TVA, Impôt des sociétésEn tant qu'employeur, vous pouvez offrir chaque année à vos employés un repas au restaurant pour la Saint-Nicolas, Noël ou le Nouvel An. D'un point de vue fiscal, ce type de repas est considéré comme une fête du personnel.16.10.2025",https://compta.webwin.be/newsletter-by-email/op-restaurant-met-uw-personeel-voor-sinterklaas-of-kerst-1
"Vérifiez dès maintenant si vos cotisations sociales pour 2025 sont encore correctes !SocialEn octobre, vous recevrez de votre caisse d'assurances sociales un décompte des cotisations sociales provisoires pour le quatrième trimestre 2025. Vous pouvez vérifier si ce montant correspond toujours à vos revenus réels.16.10.2025",https://compta.webwin.be/new-flashes/verifiez-des-maintenant-si-vos-cotisations-sociales-pour-2025-sont-encore-correctes
"Dirigeant d'entreprise (société) : indemnité forfaitaire de fraisImpôts des personnes physiquesUne indemnité forfaitaire de frais, c’est en fait le remboursement par votre société de dépenses que vous avez personnellement exposées, alors qu’elles lui incombaient en fait.14.10.2025",https://compta.webwin.be/monthly-ligthing-on/dirigeant-dentreprise-societe-indemnite-forfaitaire-de-frais
"Titre-service : dans chaque région, des règles et des avantages...Impôts des personnes physiquesAvec les titres-services, vous pouvez payer une aide-ménagère pour des tâches telles que le nettoyage, le repassage et les courses. Attention : vous ne pouvez les utiliser que pour des besoins privés, donc pas pour votre bureau ou votre espace professionnel.14.10.2025",https://compta.webwin.be/newsletter-by-email/titre-service-dans-chaque-region-des-regles-et-des-avantages
