Titre,URL
"Éco-chèques : élargissement depuis le 01.03.2023Impôts des personnes physiquesLes éco-chèques sont destinés à l'achat de produits et de services ""écologiques"" et peuvent être octroyés pour un montant maximum de 250 euros par an (avec une validité de 2 ans).07.04.2023",https://compta.webwin.be/newsletter-by-email/eco-cheques-elargissement-depuis-le-01032023
"Remboursement des primes énergie : en fonction de vos revenus netsImpôts des personnes physiquesCes derniers mois, vous avez peut-être reçu des primes gaz et électricité de la part de votre fournisseur d'énergie en tant que client domestique.07.04.2023",https://compta.webwin.be/new-flashes/remboursement-des-primes-energie-en-fonction-de-vos-revenus-nets
Wallonie : primes énergie plus élevéesImpôts des personnes physiquesLe gouvernement wallon a donné son accord en première lecture pour augmenter les primes énergie et rendre l’audit moins contraignant dans sa Région.05.04.2023,https://compta.webwin.be/new-flashes/wallonie-primes-energie-plus-elevees
"TVA sur les frais de parking entièrement déductibleImpôts - TVALa déduction de la TVA sur les frais de voiture est limitée à l'usage professionnel, avec un maximum de 50%, même si l'usage professionnel est plus élevé.05.04.2023",https://compta.webwin.be/newsletter-by-email/tva-sur-les-frais-de-parking-entierement-deductible
"Courrier de Reprobel : réagissez avant le 15.05.2023!Impôt des sociétés, Impôts des personnes physiquesReprobel est l’organisation qui perçoit la redevance que les utilisateurs professionnels doivent payer pour la réutilisation numérique et la reproduction sur papier de textes et d’images protégés par le droit d’auteur.05.04.2023",https://compta.webwin.be/new-flashes/courrier-de-reprobal-reagissez-avant-le-15052023
"Autoliquidation : depuis le 01.01.2023, aussi pour les assujettis étrangers?Impôts - TVASi vous effectuez des travaux immobiliers en Belgique pour un client assujetti à la TVA, vous devez alors les facturer avec autoliquidation. Ces règles ayant été modifiées depuis le 1er  janvier 2023, il y aura encore plus d’autoliquidation…...02.04.2023",https://compta.webwin.be/tax-dosier-of-the-month/autoliquidation-depuis-le-01012023-aussi-pour-les-assujettis-etrangers
"Fiche 281.50 que pour les services, pas les biensImpôt des sociétésLes honoraires, commissions, etc. payés par une entreprise unipersonnelle ou une société doivent en principe être déclarés sur la fiche 281.50.31.03.2023",https://compta.webwin.be/newsletter-by-email/fiche-28150-que-pour-les-services-pas-les-biens
"TVA : déclaration de substitution en 2024Impôts - TVAEn principe, votre déclaration TVA doit être déposée pour le 20 du mois suivant, selon le cas, le mois ou le trimestre durant lequel les transactions concernées ont eu lieu.31.03.2023",https://compta.webwin.be/new-flashes/tva-declaration-de-substitution-en-2024
"Région bruxelloise : outil pour le calcul des droits d'enregistrement dus à l'achat d'un logementComme vous le savez déjà, les règles en matière de droits d’enregistrement seront modifiées en cas d’achat d’une habitation familiale en Région de Bruxelles-Capitale à compter du 1er avril 2023 (abattement principal majoré et abattement complémentaire).29.03.2023",https://compta.webwin.be/new-flashes/region-bruxelloise-outil-pour-le-calcul-des-droits-denregistrement-dus-a-lachat-dun-logement
"Le délai de réclamation est passé de 6 mois à un an depuis le 01.01.2023Impôt des sociétés, Impôts des personnes physiquesIntroduire une réclamation contre une imposition pour vous ou pour votre société doit se faire endéans un certain délai.29.03.2023",https://compta.webwin.be/new-flashes/le-delai-de-reclamation-est-passe-de-6-mois-a-un-an-depuis-le-01012023
"Droit de vente réduit en Flandre : en cas de rénovation, 6 ans pour établir son domicileSi, comme personne physique, vous achetez un logement propre et unique au taux réduit de droit de vente de 3% en Flandre, vous devez alors remplir la condition de domiciliation.29.03.2023",https://compta.webwin.be/newsletter-by-email/droit-de-vente-reduit-en-flandre-en-cas-de-renovation-6-ans-pour-etablir-son-domicile
Certificat PEB à Bruxelles remaniéDroitLe certificat PEB est obligatoire en cas de vente et de location d’un logement de plus de 18 m² ou d’un bureau de plus de 500 m².22.03.2023,https://compta.webwin.be/new-flashes/certificat-peb-a-bruxelles-remanie
"Abattement complémentaire à Bruxelles à partir du 01.04.2023Comme vous le savez, les règles en matière de droits d’enregistrement seront modifiées en cas d’achat d’une habitation familiale en Région de Bruxelles-Capitale à compter du 1er avril 2023.22.03.2023",https://compta.webwin.be/new-flashes/abattement-complementaire-a-bruxelles-a-partir-du-01042023
"Délai de prescription de 3 à 4 ans en cas de dépôt tardif ou de défaut de dépôt de la déclaration TVAImpôts - TVAEn principe, la déclaration TVA périodique doit être déposée pour le 20 du mois qui suit le mois ou le trimestre.22.03.2023",https://compta.webwin.be/new-flashes/delai-de-prescription-de-3-a-4-ans-en-cas-de-depot-tardif-ou-de-defaut-de-depot-de-la-declaration-tva
"Définitivement 6% de TVA sur le gaz et l'électricité pour les contrats résidentiels à partir du 01.07.2023Impôts - TVAEn raison de la crise de l'énergie, le gouvernement fédéral avait décidé, depuis le 01.03.2022, de faire passer temporairement la TVA à 6% (au lieu de 21%) sur la livraison de gaz et l'électricité pour l'usage domestique.22.03.2023",https://compta.webwin.be/newsletter-by-email/definitivement-6-de-tva-sur-le-gaz-et-lelectricite-pour-les-contrats-residentiels-a-partir-du-01072023
"Demandez l'attestation pour les investissements économiseurs d’énergie au plus tard le 31.03.2023!Impôt des sociétés, Impôts des personnes physiquesLa déduction pour investissement (DPI) est une déduction fiscale qui vient en plus des amortissements.17.03.2023",https://compta.webwin.be/new-flashes/demandez-lattestation-pour-les-investissements-economiseurs-denergie-au-plus-tard-le-31032023
"Indemnité vélo exonérée d'impôts : 0,27€/km depuis le 01.01.2023Impôts des personnes physiquesLa société peut accorder une indemnité vélo pour les déplacements professionnels d'un dirigeant dont le bureau est situé à une autre adresse que son domicile privé et qui se rend au bureau en vélo.17.03.2023",https://compta.webwin.be/newsletter-by-email/indemnite-velo-exoneree-dimpots-027km-depuis-le-01012023
"Région bruxelloise : réduction plus importante à l’achat d’un logement à partir du 1er avril 2023Actuellement, lors de l’achat d’une habitation familiale en région de Bruxelles-Capitale de maximum 500 000€, l'acheteur ne paie pas de droits d’enregistrement sur la première tranche de 175 000€.15.03.2023",https://compta.webwin.be/new-flashes/region-bruxelloise-reduction-plus-importante-a-lachat-dun-logement-a-partir-du-1er-avril-2023
"ATN chauffage et électricité augmentés de resp. 200€ et 100€ en 2023Impôts des personnes physiquesSi un dirigeant met au nom de son entreprise des frais privés de chauffage et d'électricité et les fait facturer par son entreprise sans rembourser ces frais, ce dirigeant est alors imposé sur un avantage de toute nature (ATN).15.03.2023",https://compta.webwin.be/new-flashes/atn-chauffage-et-electricite-augmentes-de-resp-200-et-100-en-2023
"Amende routière impayée : retenue sur crédit d'impôt possibleImpôts des personnes physiquesDepuis 2020, le parquet peut décider d'envoyer un ordre de paiement pour les amendes routières impayées.15.03.2023",https://compta.webwin.be/newsletter-by-email/amende-routiere-impayee-retenue-sur-credit-dimpot-possible
"Versements anticipés pour les sociétésImpôt des sociétésSi une société veut éviter une majoration d'impôts, elle peut effectuer des versements anticipés (VA).10.03.2023",https://compta.webwin.be/new-flashes/versements-anticipes-pour-les-societes
"Location sociale : acheter ou faire construire moyennant TVA de 12%Impôts - TVAUn investisseur privé (personne physique ou morale) qui achète ou fait construire un logement pour le donner en location dans le cadre de la politique sociale peut, sous certaines conditions, bénéficier du taux réduit de 12% de TVA.10.03.2023",https://compta.webwin.be/newsletter-by-email/location-sociale-acheter-ou-faire-construire-moyennant-tva-de-12
Crise de l'énergie : demande d'aide pour les entreprises wallonnes à soumettre avant le 20.03.2023!Impôt des sociétésLe gouvernement wallon a prévu des aides financières pour les entreprises wallonnées impactées par la crise de l'énergie.08.03.2023,https://compta.webwin.be/new-flashes/crise-de-lenergie-demande-daide-pour-les-entreprises-wallonnes-a-soumettre-avant-le-20032023
"Avantage prêt gratuit : le taux de 2022 est connuImpôts des personnes physiquesSi un administrateur a une dette envers sa société, soit il doit payer des intérêts sur celle-ci, soit il est imposé à titre privé sur le fait qu'il emprunte gratuitement à sa (ATN prêt gratuit).08.03.2023",https://compta.webwin.be/new-flashes/avantage-pret-gratuit-le-taux-de-2022-est-connu
"Forfait de frais pour indépendants jusqu'à 5 520€ pour l'année de revenus 2023Impôts des personnes physiquesEn tant qu'indépendant, vous avez des frais.08.03.2023",https://compta.webwin.be/newsletter-by-email/forfait-de-frais-pour-independants-jusqua-5-520-pour-lannee-de-revenus-2023
"Taxe foncière augmentée de 5,4% environ en 2023Le revenu cadastral (RC) est indexé chaque année.03.03.2023",https://compta.webwin.be/new-flashes/taxe-fonciere-majoree-de-54-environ-en-2023
"À partir de 2023, indexation annuelle de la cotisation à charge des sociétés et paiement pour le 31.12SocialLa cotisation à charge des sociétés est une cotisation sociale devant être payée par les sociétés.03.03.2023",https://compta.webwin.be/newsletter-by-email/a-partir-de-2023-indexation-annuelle-de-la-cotisation-a-charge-des-societes-et-paiement-pour-le-3113
"Primes PLCI déductibles en 2023Social, Impôts des personnes physiquesLes primes qu'un indépendant peut verser dans sa PLCI (pension complémentaire libre) dépendent en premier lieu de ses revenus professionnels.02.03.2023",https://compta.webwin.be/new-flashes/primes-plci-deductibles-en-2023
"Pacte de colocation en Wallonie ou à Bruxelles?Il est possible, en régions bruxelloise et wallonne, pour deux ou plusieurs colocataires de conclure un pacte de colocation, avec l'accord du bailleur.01.03.2023",https://compta.webwin.be/new-flashes/pacte-de-colocation-en-wallonie-ou-a-bruxelles
Votre SRL achète un bâtiment : avec droits d’enregistrement ou TVA ?Impôts - TVAVous envisagez d’acheter un bâtiment par l’intermédiaire de votre société.01.03.2023,https://compta.webwin.be/tax-dosier-of-the-month/votre-srl-achete-un-batiment-avec-droits-denregistrement-ou-tva
"E-mail demandant de vérifier votre numéro de compte privé pour un remboursement IPP : à supprimer !Impôts des personnes physiquesLe SPF Finances informe qu'un e-mail de phishing circule, prétendument en provenance du SPF Finances, vous demandant de vérifier votre numéro de compte privé pour recevoir un remboursement IPP.24.02.2023",https://compta.webwin.be/newsletter-by-email/e-mail-demandant-de-verifier-votre-numero-de-compte-prive-pour-un-remboursement-ipp-a-supprimer
"Frais de publication au Moniteur belge en augmentation en 2023La constitution d'une société, la modification de ses statuts, la nomination ou la révocation d'administrateurs ou de gérants doivent faire l'objet d'un dépôt au greffe du tribunal de l'entreprise et d'une publication aux Annexes du Moniteur belge.24.02.2023",https://compta.webwin.be/new-flashes/frais-de-publication-au-moniteur-belge-en-augmentation-en-2023
"Région wallonne : prolongation du prêt Coup de Pouce publiée au MBImpôts des personnes physiquesPour rappel, le prêt coup de pouce permet à une PME établie en Région wallonne d'emprunter de l'argent à certains particuliers pour financer ses activités.22.02.2023",https://compta.webwin.be/new-flashes/region-wallonne-prolongation-du-pret-coup-de-pouce-publiee-au-mb
"Indemnités journalières : nouvelle liste de paysImpôt des sociétés, Impôts des personnes physiquesLorsqu'un administrateur effectue un voyage d'affaires pour sa société (au moins 10 heures), la société peut lui accorder une indemnité journalière forfaitaire.22.02.2023",https://compta.webwin.be/new-flashes/indemnites-journalieres-nouvelle-liste-de-pays
Travailler après la pension : montants pour 2023Impôts des personnes physiquesLe travailleur ayant une carrière d'au moins 45 ans ou âgé d'au moins 65 ans peut encore travailler après sa pension.22.02.2023,https://compta.webwin.be/newsletter-by-email/travailler-apres-la-pension-montants-pour-2023
"Fiches personnel 2022 : à vérifier à tempsImpôts des personnes physiquesEn principe, tous les débiteurs de revenus doivent introduire les fiches fiscales 281.10 à 281.50 par voie électronique.17.02.2023",https://compta.webwin.be/newsletter-by-email/fiche-personnel-2022-a-verifier-a-temps
Pas d'avantage imposable plus élevé en 2023 pour la mise à disposition gratuite de matériel ITImpôts des personnes physiques17.02.2023,https://compta.webwin.be/new-flashes/pas-davantage-imposable-plus-eleve-en-2023-pour-la-mise-a-disposition-gratuite-de-materiel-it
Investissements liés à l’économie d’énergie en Région wallonneImpôt des sociétésIl existe des aides spécifiques qui encouragent les investissements permettant d’utiliser durablement l’énergie ou de protéger l’environnement.15.02.2023,https://compta.webwin.be/new-flashes/investissements-lies-a-leconomie-denergie-en-region-wallonne
Listing clients TVA de 2022 à déposer pour le 30.03.2023Impôts - TVALe listing clients est une liste devant être déposée chaque année auprès de l'administration TVA.15.02.2023,https://compta.webwin.be/new-flashes/listing-clients-tva-de-2022-a-deposer-pour-le-30032023
Forfait de frais bourgmestre et échevins pour 2023Impôts des personnes physiquesLa rémunération pour l'exercice de la fonction de bourgmestre ou d'échevin est fixée par la loi.15.02.2023,https://compta.webwin.be/newsletter-by-email/forfait-de-frais-bourgmestre-et-echevins-pour-2023
"Indemnité pour déplacements à vélo majorée depuis le 01.01.2023Impôt des sociétés, Impôts des personnes physiquesSi vous, dirigeant, vous rendez au bureau en vélo, votre société peut vous octroyer une indemnité exemptée de précompte professionnel et de cotisations sociales pour indépendants.14.02.2023",https://compta.webwin.be/newsletter-by-email/indemnite-pour-deplacements-a-velo-majoree-depuis-le-01012023
"Colonnes de la déclatation IPP en fonction de l'âge à partir de 2023Impôts des personnes physiquesJusque et y compris l’année de revenus 2021/EI 2022, sur les déclarations des couples (de sexe opposé) mariés ou cohabitant légalement, les données de l'homme étaient systématiquement placées avant celles de la femme.10.02.2023",https://compta.webwin.be/new-flashes/colonnes-de-la-declatation-ipp-en-fonction-de-lage-a-partir-de-2023
"Aides pour les factures d'énergie pour les entreprises en WallonieImpôt des sociétésEn ces temps de crise, les factures pour l'énergie ont considérablement augmenté.08.02.2023",https://compta.webwin.be/new-flashes/aides-pour-les-factures-denergie-pour-les-entreprises-en-wallonie
Attestation de validité d'un numéro TVA EU via MyMinfinImpôts - TVA08.02.2023,https://compta.webwin.be/new-flashes/attestation-de-validite-dun-numero-tva-eu-via-myminfin
Les montants relatifs aux indemnités pour volontaires pour 2023 sont connusImpôts des personnes physiquesLes volontaires du secteur sportif et socioculturel peuvent bénéficier d'une indemnité de frais.08.02.2023,https://compta.webwin.be/newsletter-by-email/les-montants-relatifs-aux-indemnites-pour-volontaires-pour-2023-sont-connus
"À partir du 01.04.2023, encore une déduction de 150% pour les bornes de rechargeImpôt des sociétés, Impôts des personnes physiquesLes indépendants ou sociétés peuvent, pour l'acquisition d'une nouvelle borne de recharge accessible au public bénéficier, sous certaines conditions, d'une déduction de frais de majorée.03.02.2023",https://compta.webwin.be/newsletter-by-email/a-partir-du-01042023-encore-une-deduction-de-150-pour-les-bornes-de-recharge
Indemnité kilométrique indexée pour le premier trimestre 2023Impôts des personnes physiquesLes travailleurs qui effectuent des déplacements professionnels avec leur propre voiture peuvent recevoir une indemnité kilométrique de leur employeur.03.02.2023,https://compta.webwin.be/new-flashes/indemnite-kilometrique-indexee-pour-le-premier-trimestre-2023
"Ouvrir un gîte en Wallonie ? Permis d'urbanisme requis à compter du 30.01.2023DroitLe contribuable qui, à partir du 30 janvier 2023, souhaite ouvrir un hébergement touristique en Région wallonne doit introduire une demande de permis d’urbanisme.01.02.2023",https://compta.webwin.be/new-flashes/ouvrir-un-gite-en-wallonie-permis-durbanisme-requis-a-compter-du-30012023
Petite entreprise et TVA : il ne faut pas le redemander chaque année !Impôts - TVAL'assujetti qui opte pour le régime de franchise des petites entreprises (TVA) ne doit pas déposer de déclarations TVA périodiques.01.02.2023,https://compta.webwin.be/newsletter-by-email/petite-entreprise-et-tva-il-ne-faut-pas-le-redemander-chaque-annee
"Affectation réelle assujetti mixte : informations complémentaires à ne communiquer qu'en 2024Impôts - TVAUn assujetti mixte, étant un assujetti qui exerce tant une activité exemptée qu'une activité assujettie à la TVA, ne peut déduire qu'en partie la TVA sur ses achats.01.02.2023",https://compta.webwin.be/new-flashes/affectation-reelle-assujetti-mixte-informations-complementaires-a-ne-communiquer-quen-2024
Remplacer votre voiture actuelle par une voiture hybride en 2023 ?Impôt des sociétésLa voiture de votre société est (presque) amortie.01.02.2023,https://compta.webwin.be/tax-dosier-of-the-month/remplacer-votre-voiture-actuelle-par-une-voiture-hybride-en-2023
"Qu'est-ce qu'une unité TVA? Qui peut/doit en faire partie? Quelles sont les conditions applicables?Impôts - TVARegardons les conditions ""de liens"" de l'unité TVA.01.02.2023",https://compta.webwin.be/monthly-ligthing-on/quest-ce-quune-unite-tva-qui-peutdoit-en-faire-partie-quelles-sont-les-conditions-applicables
"Réduction Pr I en Flandre : depuis 2023, 8€ par enfant avec allocations familialesEn Flandre, il existe une réduction du précompte immobilier pour le logement familial s'il est occupé au 1er janvier de l'exercice d'imposition concerné par une famille ayant au moins deux enfants pour lesquels on perçoit des allocations familiales et ayant leur résidence dans ce logement.26.01.2023",https://compta.webwin.be/newsletter-by-email/reduction-pr-i-en-flandre-depuis-2023-8-par-enfant-avec-allocations-familiales
"Frais de garde d'enfant 2022: numéro national parent/enfant pas requisImpôts des personnes physiquesPour les enfants jusqu'à 14 ans (ou les enfants handicapés jusqu'à 21 ans), il existe une réduction d'impôts en matière d'IPP pour les frais de garde d'enfants.26.01.2023",https://compta.webwin.be/new-flashes/frais-de-garde-denfant-2022-numero-national-parentenfant-pas-requis
"Des logements en «gestion publique» à Bruxelles ?DroitDepuis le 23 décembre 2022, un logement à Bruxelles qui est inoccupé ou déclaré inadapté depuis longtemps pourrait être plus vite mis en «gestion publique».25.01.2023",https://compta.webwin.be/new-flashes/des-logements-en-gestion-publique-a-bruxelles
"Intérêts en cas de retard de paiement dans une relation opération B2B : 10,50% pour le premier semestre de 2023Impôt des sociétés, Impôts des personnes physiquesLes clients d'entreprises qui ne paient pas à temps peuvent se voir imputer des intérêts de retard.25.01.2023",https://compta.webwin.be/new-flashes/interets-en-cas-de-retard-de-paiement-dans-une-relation-operation-b2b-1050-pour-le-premier-semestre-de-2023
"Autoliquidation en cas de travaux immobiliers : depuis le 01.01.2023, pour tous les assujettis étrangers avec un numéro BEImpôts - TVAUn assujetti à la TVA qui est établi à l'étranger (UE) peut, sous certaines conditions, s'identifier à la TVA en Belgique de deux manières : via une identification directe ou via un représentant responsable.20.01.2023",https://compta.webwin.be/new-flashes/autoliquidation-en-cas-de-travaux-immobiliers-depuis-le-01012023-pour-tous-les-assujettis-etrangers-avec-un-numero-be
"Quel montant d'intérêts demander à votre société en 2023?Impôts des personnes physiquesSi vous avez une créance vis-à-vis de votre société, les intérêts que paie votre société sont alors en principe déductibles.20.01.2023",https://compta.webwin.be/newsletter-by-email/quel-montant-dinterets-demander-a-votre-societe-en-2023
Prime rénovation en Wallonie en 2023Impôts des personnes physiquesVous êtes résident wallon et envisagez de faire des travaux de rénovation dans votre bâtiment?18.01.2023,https://compta.webwin.be/new-flashes/prime-renovation-en-wallonie-en-2023
"ATN logement gratuit augmente d'environ 9,59% pour l'année de revenus 2023Impôts des personnes physiquesUn dirigeant qui habite gratuitement dans le bâtiment de sa société, est imposé pour cela à l'IPP via un avantage de toute nature (ATN).18.01.2023",https://compta.webwin.be/newsletter-by-email/atn-logement-gratuit-augmente-denviron-959-pour-lannee-de-revenus-2023
"Registre UBO plus accessible temporairementImpôt des sociétésLe registre UBO est un registre dans lequel sont inscrits tous les ""Ultimate Beneficial Owners"" ou ""bénéficiaires effectifs"" d'une société ou d'une autre entité juridique.18.01.2023",https://compta.webwin.be/new-flashes/registre-ubo-plus-accessible-temporairement
"Le nombre maximum d'heures de travail étudiant pour l'ONSS est porté à 600 depuis le 01.01.2023SocialJusqu'à la fin de l'année 2022, un étudiant pouvait travailler un maximum de 475 heures par an (par le biais d'un contrat étudiant) sans devoir payer les cotisations ONSS normales.13.01.2023",https://compta.webwin.be/newsletter-by-email/le-nombre-maximum-dheures-de-travail-etudiant-pour-lonss-est-porte-a-600-depuis-le-01012023
Notification affectation réelle pour les assujettis mixtes : attention aux délaisImpôts - TVAUn assujetti mixte est un assujetti qui exerce des activités assujetties à la TVA ainsi que des activités exemptées de TVA.13.01.2023,https://compta.webwin.be/new-flashes/notification-affectation-reelle-pour-les-assujettis-mixtes-attention-aux-delais
"Wallonie : droits d'enregistrement réduits -  montants pour 2023En Région wallonne, l’acquisition d’un immeuble est soumise aux droits d’enregistrement au taux ordinaire de 12,5%.11.01.2023",https://compta.webwin.be/new-flashes/wallonie-droits-denregistrement-reduits-montants-pour-2023
"Hausse de l'indemnité de télétravail depuis le 01.01.2023Impôts des personnes physiquesUn employeur peut accorder une indemnité de télétravail forfaitaire pour le chauffage, l'électricité, le petit matériel de bureau, etc. (le forfait de bureau) pour les employés qui font du télétravail au moins l'équivalent d'un jour ouvrable par semaine.11.01.2023",https://compta.webwin.be/new-flashes/hausse-de-lindemnite-de-teletravail-depuis-le-01012023
"Le congé de paternité passe à 20 jours pour les naissances depuis le 01.01.2023SocialLes indépendants à titre principal et les conjoints aidants (maxi-statut) ont droit, depuis le 1er mai 2019, à un congé de paternité à l'occasion de la naissance d'un enfant pour lequel ils ont un lien de filiation.11.01.2023",https://compta.webwin.be/newsletter-by-email/le-conge-de-paternite-passe-a-20-jours-pour-les-naissances-depuis-le-01012023
"Enregistrer la donation de biens meubles afin d'éviter les droits de successionSi vous effectuez une donation devant notaire, vous devez en principe payer des droits de donation (vu que le notaire doit faire enregistrer la donation).06.01.2023",https://compta.webwin.be/newsletter-by-email/enregistrer-la-donation-de-biens-meubles-afin-deviter-les-droits-de-succession
"Indemnité pour déplacements en Belgique indexée depuis le 01.01.2023Impôt des sociétés, Impôts des personnes physiquesLorsqu'un dirigeant effectue des déplacements professionnels en Belgique d'au moins 6h par jour, il peut s'octroyer une indemnité forfaitaire.06.01.2023",https://compta.webwin.be/new-flashes/indemnite-pour-deplacements-en-belgique-indexee-depuis-le-01012023
"Prêt coup de pouce wallon prolongé jusqu'au 31.12.2024Impôts des personnes physiquesLe prêt ""coup de pouce"" permet à une PME établie en Région wallonne d'emprunter de l'argent à certains particuliers.04.01.2023",https://compta.webwin.be/new-flashes/pret-coup-de-pouce-wallon-prolonge-jusquau-31122024
"Baisse temporaire du taux TVA pour l'électricité et le gaz prolongée jusqu'au 31.03.2023Impôts - TVAEn raison de la forte hausse des prix de l'énergie, le gouvernement fédéral avait décidé de réduire temporairement le taux de TVA sur l'électricité à 6% depuis le 01.03.2022 et jusqu'au 30.09.2022.04.01.2023",https://compta.webwin.be/newsletter-by-email/baisse-temporaire-du-taux-tva-pour-lelectricite-et-le-gaz-polongee-jusquau-31032023
