Titre,URL
"Faire don du compte courant de votre entreprise à vos enfantsImpôts - Héritage et donationsDe nombreux entrepreneurs ont un compte courant créditeur (créance) sur leur société. A leur décès, cela représente un actif dans la succession sur lequel les héritiers sont imposés.19.07.2024",https://compta.webwin.be/newsletter-by-email/faire-don-du-compte-courant-de-votre-entreprise-a-vos-enfants
Moins de cotisations sociales pour un primostarterSocialUn primostarter est un indépendant à titre principal qui n'a jamais été un travailleur indépendant à titre principal ou ou un travailleur indépendant à titre principal assimilé à un travailleur indépendant à titre complémentaire au cours des 20 trimestres précédant le début ou la reprise de son activité indépendante17.07.2024,https://compta.webwin.be/newsletter-by-email/moins-de-cotisations-sociales-pour-un-primostarter
"Précompte mobilier payé en retard lors d'une distribution de dividendes : intérêts de retardImpôt des sociétésSi votre société distribue un dividende, celle-ci doit alors retenir le précompte mobilier et le reverse à l'Etat.17.07.2024",https://compta.webwin.be/new-flashes/precompte-mobilier-paye-en-retard-lors-dune-distribution-de-dividendes-interets-de-retard
"Job d'étudiant en 2024 : combien votre enfant peut-il gagner?Impôts des personnes physiquesPour être à charge fiscalement, votre enfant ne peut pas percevoir, en 2024, plus de 7 290€ de ressources nettes.12.07.2024",https://compta.webwin.be/newsletter-by-email/job-detudiant-en-2024-combien-votre-enfant-peut-il-gagner
"La BCE demande vos données d'entreprise : soyez vigilant!Impôts des personnes physiquesActuellement, il y a une tentative de phishing en circulation qui vous demande de mettre à jour vos données professionnelles et informations sur votre entreprise.12.07.2024",https://compta.webwin.be/new-flashes/la-bce-demande-vos-donnees-dentreprise-soyez-vigilant
"Les nombreuses possibilités de MyMinfinImpôt des sociétés, Impôts des personnes physiquesLa page d'accueil de MyMinfin est divisée en cinq sections.10.07.2024",https://compta.webwin.be/newsletter-by-email/les-nombreuses-possibilites-de-myminfin
Vous avez jusqu'au 16.10.2024 pour introduire votre déclaration « complexe » à l'IPP pour l'exercice d'imposition 2024Impôts des personnes physiquesLes personnes qui déposent leur déclaration IPP « non complexe » pour l'année de revenus 2023/exercice d'imposition 2024 en ligne via Tax-on-web avaient normalement jusqu'au 15 juillet 2024 pour le faire.10.07.2024,https://compta.webwin.be/new-flashes/vous-avez-jusquau-16102024-pour-introduire-votre-declaration-complexe-a-lipp-pour-lexercice-dimposition-2024
"Déclaration à l'IPP et à l'IPM: modèle d'annexe pour les constructions juridiquesImpôts des personnes physiquesLe 21.06.2024, l'administration fiscale a publié au Moniteur belge le modèle d'annexe pour la déclaration à l'IPP et à l'IPM pour les constructions juridiques.05.07.2024",https://compta.webwin.be/new-flashes/declaration-a-lipp-et-a-lipm-modele-dannexe-pour-les-constructions-juridiques
"Plug-in hybride : ATN et déduction de fraisImpôt des sociétés, Impôts des personnes physiquesSi votre société a acheté, loué ou pris en leasing une voiture hybride rechargeable depuis le 1er janvier 2023, les coûts du carburant fossile de celle-ci sont déductibles à 50 %, quel que soit le pourcentage de déduction applicable aux autres frais.05.07.2024",https://compta.webwin.be/newsletter-by-email/plug-in-hybride-atn-et-deduction-de-frais
"Refacturation de frais de voiture et limitation de la déduction de la TVAImpôts - TVAQuelles règles TVA sont applicables à la refacturation de frais, et pour qui la déduction est-elle limitée en cas de refacturation de frais de voiture ? À quoi être attentif, et qu’a récemment dit le ministre à ce propos ?03.07.2024",https://compta.webwin.be/tax-dosier-of-the-month/refacturation-de-frais-de-voiture-et-limitation-de-la-deduction-de-la-tva
"PCLI, PLCS et CPTIImpôts des personnes physiquesLes pensions, rentes et allocations en tenant lieu sont imposables en tant que revenus professionnels, et ce quel qu’en soit le bénéficiaire, le débiteur ou la qualifi-cation. Regardons de plus près la PCLI, la PLCS et la CPTI.03.07.2024",https://compta.webwin.be/monthly-ligthing-on/pcli-plcs-et-cpti
Régime TVA des petites entreprises à partir du 01.01.2025 également à l'étrangerImpôts - TVALe régime des petites entreprises est un régime de franchise de TVA pour ceux qui réalisent un chiffre d’affaires de leur entreprise ou société n'excédant pas 25.000 € (hors TVA). Vous n'avez alors pas à facturer la TVA sur vos ventes et vous n'avez pas non plus à soumettre de déclarations TVA.03.07.2024,https://compta.webwin.be/newsletter-by-email/regime-des-petites-entreprises-pour-la-tva-a-partir-du-01012025-egalement-a-letranger
"Numérisation de la déclaration au cadastre d'une nouvelle construction ou d'une modification d'un bien immobilierImpôts des personnes physiquesDepuis le 28.06.2024, il est possible de soumettre la déclaration pour la mise en service d'une nouvelle construction ou une modification d'un bien immobilier via MyMinfin.03.07.2024",https://compta.webwin.be/new-flashes/numerisation-de-la-declaration-au-cadastre-dune-nouvelle-construction-ou-dune-modification-dun-bien-immobilier
"Garde d'enfants en frais de société : taxation à l'IPP sur l'avantage de toute natureImpôt des sociétés, Impôts des personnes physiquesEn principe, les frais de garde d'enfants sont déductibles pour une société sur la base de la théorie de la rémunération si vous pouvez démontrer que votre société engage ces frais en échange de prestations que vous réalisez en tant que dirigeant de votre société (Cass. 14.10.2016).28.06.2024",https://compta.webwin.be/newsletter-by-email/garde-denfants-en-frais-de-societe-taxation-privee-sur-lavantage-de-toute-nature
"Réponses aux demandes de renseignements concernant une autre personne ?Impôt des sociétés, Impôts des personnes physiquesL'administration fiscale a le droit de vous poser des questions sur des tiers désignés (art. 322 CIR 92).28.06.2024",https://compta.webwin.be/new-flashes/reponses-aux-demandes-dinformations-concernant-une-autre-personne
"Votre société doit-elle effectuer un versement anticipé avant le 10 juillet ?Impôt des sociétésBien que les versements anticipés ne soient pas obligatoires, votre société doit payer une majoration d'impôt/une amende de 9% si elle ne paie pas à l'avance.26.06.2024",https://compta.webwin.be/new-flashes/votre-societe-doit-elle-effectuer-un-paiement-anticipe-avant-le-10-juillet
"Contrat de bail non enregistré : le loyer est-il déductible ?Impôt des sociétés, Impôts des personnes physiquesDepuis l'exercice d'imposition 2024, vous/votre société devez tenir compte de deux éléments pour déduire fiscalement les loyers.26.06.2024",https://compta.webwin.be/newsletter-by-email/contrat-de-bail-non-enregistre-le-loyer-est-il-deductible
"Comptes annuels de 2023 à déposer pour le 31.07.2024 au plus tardImpôt des sociétésDéposer ses comptes annuels est obligatoire si votre société est une SRL, une SA, une SCA ou une SC.21.06.2024",https://compta.webwin.be/new-flashes/comptes-annuels-de-2023-a-deposer-pour-le-31072024-au-plus-tard
Communiquer vos comptes à l'étrangerImpôts des personnes physiquesL'Etat belge exige que vous déclariez chaque compte étranger au Point de Contact Central (PCC) de la Banque Nationale de Belgique.21.06.2024,https://compta.webwin.be/newsletter-by-email/communiquer-vos-comptes-a-letranger
Quand faut-il reconfirmer le registre UBO de votre entreprise ?Impôt des sociétésVous devez confirmer chaque année l'inscription de votre entreprise au registre UBO.19.06.2024,https://compta.webwin.be/newsletter-by-email/quand-faut-il-reconfirmer-le-registre-ubo-de-votre-entreprise
"Plus de temps pendant les vacances pour répondre aux questions du fisc ?Impôts - TVA, Impôt des sociétés, Impôts des personnes physiquesEn principe, vous devez répondre aux demandes de renseignements ou aux avis de rectificaton du fisc dans un délai d'un mois, à compter du troisième jour ouvrable suivant l'envoi de la question.19.06.2024",https://compta.webwin.be/new-flashes/plus-de-temps-pendant-les-vacances-pour-repondre-aux-questions-du-fisc
"Vérification de l'état de vos cotisations socialesSocialChaque trimestre, votre caisse d'assurances sociales vous envoie un décompte de vos cotisations sociales provisoires et chaque année, vous recevez un décompte final dans lequel vous devez soit payer des cotisations sociales supplémentaires, soit vous faire rembourser.14.06.2024",https://compta.webwin.be/newsletter-by-email/verification-de-letat-de-vos-cotisations-sociales
"Adapter à temps la proposition de déclaration simplifiéeImpôts des personnes physiquesComme dirigeant de votre société, vous ne recevez en principe pas de proposition de déclaration simpliée (PDS), mais c'est peut-être le cas de vos parents pensionnés ou de votre enfant?14.06.2024",https://compta.webwin.be/new-flashes/adapter-a-temps-la-proposition-de-declaration-simplifiee
"Facilités TVA pour l'été 2024Impôts - TVAComme chaque année, l’administration prévoit certaines tolérances quant aux délais de dépôt des déclarations TVA pour l’été.12.06.2024",https://compta.webwin.be/new-flashes/facilites-tva-pour-lete-2024
"Augmentation de l'indemnité de télétravail de 2% depuis le 1er juin 2024Impôt des sociétés, Impôts des personnes physiquesLes employés qui télétravaillent régulièrement peuvent recevoir de leur employeur une ""indémnité de télétravail"" forfaitaire pour le chauffage, l'électricité, le petit matériel de bureau, etc.12.06.2024",https://compta.webwin.be/newsletter-by-email/augmentation-de-indemnite-de-teletravail-de-2-depuis-le-1er-juin-2024
Quelle TVA sur le facture pour recharger ma voiture électrique?Impôts - TVAVous faites recharger votre voiture électrique en Belgique et à l'étranger. Quelle TVA est-elle due sur la facture? Le ministre des Finances a été confronté à cette question au début de l'année 2024.07.06.2024,https://compta.webwin.be/newsletter-by-email/quelle-tva-sur-le-facture-pour-recharger-ma-voiture-electrique
Oubli/erreur dans votre déclaration IPP : corrigez-la vous-même à tempsImpôts des personnes physiquesVous ou votre gestionnaire de dossier avez déjà introduit votre déclaration IPP via Tax-on-web. Vous constatez cependant qu'il y a une erreur ou que vous avez oublié quelque chose.07.06.2024,https://compta.webwin.be/new-flashes/oublierreur-dans-votre-declaration-dimpot-sur-le-revenu-des-personnes-physiques-corrigez-la-vous-meme-a-temps
"Tantième et cotisations socialesImpôt des sociétés, Impôts des personnes physiquesVous vous êtes attribué, en tant qu'administrateur, lors de la récente assemblée générale en 2024, un tantième sur le bénéfice de votre société de l'exercice comptable 2023. Étant donné qu'un tantième est considéré comme un salaire, vous devez payer des cotisations sociales dessus.05.06.2024",https://compta.webwin.be/new-flashes/tantieme-et-cotisation-sociale
Le registre UBO de votre société est-il en ordre?Impôt des sociétésLe registre UBO vise à identifier les bénéficiaires effectifs des personnes morales.05.06.2024,https://compta.webwin.be/newsletter-by-email/le-registre-ubo-de-votre-societe-est-il-en-ordre
"Cadeau de mariage de la société : déductible fiscalement?Impôt des sociétés, Impôts des personnes physiquesSupposons que vous ou l'un de vos employés allez vous marier prochainement. Pour cette occasion, vous faites acheter un cadeau par votre société.04.06.2024",https://compta.webwin.be/new-flashes/cadeau-de-mariage-de-la-societe-deductible-fiscalement
"Avantages fiscaux pour petites sociétésImpôt des sociétés, Impôts des personnes physiquesPour que votre société puisse bénéficier de certains avantages en matière d’ISoc, de précompte mobilier (Pr M) et d’IPP, il faut notamment qu’elle soit considérée comme «petite». De quels avantages s’agit-il, quand votre société est-elle «petite» ou «micro » ?03.06.2024",https://compta.webwin.be/tax-dosier-of-the-month/avantages-fiscaux-pour-petites-societes
"Fête d'entreprise au bureau : entièrement en frais ?Impôt des sociétésSelon le fisc, tous les frais engagés par un contribuable dans le cadre de ses relations externes, pour la réception de clients, fournisseurs, relations d'affaires ou tiers, sont considérés comme des frais de réception (Com. IR 92 n° 53/144-145).31.05.2024",https://compta.webwin.be/newsletter-by-email/te-dentreprise-au-bureau-entierement-en-frais
"Entreprise débutante : payer la cotisation à charge des sociétés?SocialLes sociétés doivent payer, une fois par an, la cotisation à charge des sociétés.29.05.2024",https://compta.webwin.be/new-flashes/entreprise-debutante-payer-la-cotisation-a-charge-des-societes
"Placer une borne de recharge : revenu cadastral plus élevé?Impôts - TVAL'administration Mesures et Évaluations, mieux connue sous le nom de cadastre, procède à la réévaluation du revenu cadastral (RC) lorsque vous agrandissez, reconstruisez ou modifiez considérablement un bâtiment.29.05.2024",https://compta.webwin.be/newsletter-by-email/placer-une-borne-de-recharge-revenu-cadastral-plus-eleve
"ATN logement meublé : que vise-t-on?Impôt des sociétés, Impôts des personnes physiquesSi une société met gratuitement à la disposition de son dirigeant un logement meublé, il est alors imposé sur cela via un avantage de toute nature.24.05.2024",https://compta.webwin.be/new-flashes/atn-logement-meuble-que-vise-t-on
"En vacances avec la voiture de votre société : conséquences fiscalesImpôt des sociétés, Impôts des personnes physiquesSi une société met gratuitement une voiture à la disposition de son dirigeant, celui-ci sera imposé via un avantage de toute nature (ATN).24.05.2024",https://compta.webwin.be/newsletter-by-email/en-vacances-avec-la-voiture-de-votre-societe-consequences-fiscales
Adapter son épargne-pension : qu'est-ce qui est possible?Impôts des personnes physiquesVous avez une assurance épargne-pension ou un fonds d'épargne-pension22.05.2024,https://compta.webwin.be/new-flashes/adapter-son-epargne-pension-quest-ce-qui-est-possible
"Quand votre facture est-elle prescrite?Impôts - TVA, Impôt des sociétés, Impôts des personnes physiquesUne facture ne peut pas être réclamée à perpétuité. Le législateur a introduit à cet effet la prescription libératoire.22.05.2024",https://compta.webwin.be/newsletter-by-email/quand-votre-facture-est-elle-prescrite
Où reste donc mon AER IPP pour l'année de revenus 2022?Impôts des personnes physiquesLe fisc a jusqu'au 30 juin 2024 pour vous communiquer votre AER à l'IPP pour l'année de revenus 2022 (déclaration déposée à l'automne 2023).18.05.2024,https://compta.webwin.be/new-flashes/ou-reste-donc-mon-aer-ipp-pour-lannee-de-revenus-2022
"Refacturation du précompte immobilier : quid de la TVA?Impôts - TVAEn principe, le précompte immobilier est dû par le propriétaire, l'usufruitier, etc.18.05.2024",https://compta.webwin.be/newsletter-by-email/refacturation-du-precompte-immobilier-quid-de-la-tva
"Indemnité pour nuitée plus élevée à partir du 1er juin 2024Impôt des sociétés, Impôts des personnes physiquesSi vous ou votre travailler doit passer la nuit en Belgique dans le cadre d'une mission, vous pouvez prendre la facture d'hôtel à votre charge ou accorder une indemnité forfaitaire.15.05.2024",https://compta.webwin.be/new-flashes/indemnite-pour-nuitee-plus-elevee-a-partir-du-1er-juin-2024
"Pourquoi est-il préférable de déclarer un vol?Impôts - TVA, Impôt des sociétés, Impôts des personnes physiquesSupposons qu'il y a eu un cambriolage dans votre entreprise et que certains objets aient été volés.15.05.2024",https://compta.webwin.be/newsletter-by-email/pourquoi-est-il-preferable-de-declarer-un-vol
"Indemnité journalière pour séjour en Belgique indexée à partir du 1er juin 2024Impôt des sociétés, Impôts des personnes physiquesLorsqu'un dirigeant effectue des déplacements professionnels en Belgique d'au moins 6h par  jour, il peut se verser une indemnité forfaitaire pour cela.11.05.2024",https://compta.webwin.be/new-flashes/indemnite-journaliere-pour-sejour-en-belgique-indexee-a-partir-du-1er-juin-2024
"TVA et passage au régime de franchise des petites entreprises : seuil de 25 000€Impôts - TVASi le chiffre d'affaires de votre entreprise en 2023 est inférieur à 25000€ HTVA, vous pouvez éventuellement passer au régime des petites entreprises à partir du 1er juillet 2024.11.05.2024",https://compta.webwin.be/newsletter-by-email/tva-et-passage-au-regime-de-franchise-des-petites-entreprises-seuil-de-25-000
Avantage imposable microcar électrique?Impôts des personnes physiquesLes microcars sont de petites voitures électriques dans laquelle il y a en général de la place pour deux personnes.08.05.2024,https://compta.webwin.be/new-flashes/avantage-imposable-microcar-electrique
"Chèques sport et culture électroniques à partir du 1er juillet 2024Impôt des sociétés, Impôts des personnes physiquesLes chèques sport et culture sont considérés comme un avantage social.08.05.2024",https://compta.webwin.be/newsletter-by-email/cheques-sport-et-culture-electronique-a-partir-du-1er-juillet-2024
Bonus en pension (à nouveau) en vigueur à partir de 2025Impôts des personnes physiquesLe bonus pension est un versement exonéré d'impôts que vous recevez si vous continuez à travailler après la date à laquelle vous auriez pu prendre votre pension.05.05.2024,https://compta.webwin.be/new-flashes/bonus-en-pension-a-nouveau-en-vigueur-a-partir-de-2025
Pouvez-vous modifier la langue de votre déclaration IPP?Impôts des personnes physiquesVous devez déposer votre déclaration IPP dans la langue officielle du territoire linguistique sur lequel vous êtes domicilié au 1er janvier de l'exercice d'imposition.05.05.2024,https://compta.webwin.be/newsletter-by-email/pouvez-vous-modifier-la-langue-de-votre-declaration-ipp
"Dividende ou tantième ?Impôt des sociétésVous voulez distribuer du bénéfice lors de l’affectation du résultat de l’EC 2023. Vous avez alors le choix entre un dividende et un tantième. Quelles sont les similitudes et les différences entre ces deux options, et laquelle est la moins chère ?03.05.2024",https://compta.webwin.be/tax-dosier-of-the-month/dividende-ou-tantieme
"Biztax disponible depuis le 29.04.2024 pour les sociétés et les personnes moralesImpôt des sociétésBiztax est l'application permettant de remplir les déclarations à l'impôt des sociétés, l'impôt des personnes morales et l'impôt des non résidents - sociétés.02.05.2024",https://compta.webwin.be/new-flashes/biztax-disponible-depuis-le-29042024-pour-les-societes-et-les-personnes-morales
Distribution des réserves de liquidation : compter de jour à jourImpôt des sociétésUne société retient  un précompte mobilier de 5% sur la distribution de réserves de liquidation lorsque cette distribution a lieu après cinq ans.02.05.2024,https://compta.webwin.be/newsletter-by-email/distribution-des-reserves-de-liquidation-compter-de-jour-a-jour
Tax-on-Web disponible en ligne depuis le 24.04.2024Impôts des personnes physiquesLe fisc a tenu sa conférence de presse le 24.04.2024 concernant la déclaration IPP relative à l'année de revenus 2023/EI 2024.26.04.2024,https://compta.webwin.be/new-flashes/tax-on-web-disponible-en-ligne-depuis-le-24042024
"Proposition de déclaration simplifiée à l'IPP : examinez-la à temps!Impôts des personnes physiquesEn principe, vous recevez du fisc une proposition de déclaration simplifiée à l'impôt des personnes physiques si votre situation fiscale est ""très stable"".26.04.2024",https://compta.webwin.be/newsletter-by-email/proposition-de-declaration-simplifiee-a-lipp-examinez-la-a-temps
"Franchise TVA pour petites entreprises à demander avant le 1er juin 2024Impôts - TVAGrâce au régime de franchise pour petites entreprises en matière de TVA, l'assujetti ne doit pas remplir certaines obligations TVA.24.04.2024",https://compta.webwin.be/new-flashes/franchise-tva-pour-petites-entreprises-a-demander-avant-le-1er-juin-2024
"Connexion via MyMinfin simplifiée depuis le 3 avril 2024Impôt des sociétés, Impôts des personnes physiquesMyMinfin est devenu l'endroit incontournable pour les échanges d'informations avec le fisc, que ce soit à titre privé ou en tant que dirigeant/gérant d'une société.24.04.2024",https://compta.webwin.be/newsletter-by-email/connexion-via-myminfin-simplifiee-depuis-le-3-avril-2024
"Actes notariés : signature numérique depuis le 08.04.2024Si vous passez un acte devant notaire, vous devez parapher chaque page et signer à la fin du document.19.04.2024",https://compta.webwin.be/new-flashes/actes-notaries-signature-numerique-depuis-le-08042024
"Internet : plusieurs avantages imposables?Impôts des personnes physiquesSi comme administrateur, vous utilisez, via votre société, une connexion Internet gratuitement, vous êtes alors imposé à l'IPP sur un avantage de toute nature de 60€ par an.19.04.2024",https://compta.webwin.be/newsletter-by-email/internet-plusieurs-avantages-imposables
"Réformes TVA reportées à 2025Impôts - TVAEn principe, une série de modifications TVA devaient entrer en vigueur début 2024 (nouvelle chaine TVA).17.04.2024",https://compta.webwin.be/new-flashes/reformes-tva-reportees-a-2025
Toujours de la TVA à l'importation de biens en Belgique?Impôts - TVACelui qui importe des biens en Belgique depuis un pays non EU doit en principe payer de la TVA sur cette importation.17.04.2024,https://compta.webwin.be/newsletter-by-email/toujours-de-la-tva-a-limportation-de-biens-en-belgique
"Fiche 181.50 pour les honoraires et commissions payés en 2023 à déposer pour le 29.06.2024 au plus tardImpôt des sociétésSi, en 2023, vous avez payé des honoraires, commissions, etc. ceux-ci doivent en principe être mentionnés sur une fiche 281.50.12.04.2024",https://compta.webwin.be/new-flashes/fiche-18150-pour-les-honoraires-et-commissions-payes-en-2023-a-deposer-pour-le-29062024-au-plus-tard
"Places de parking pour vos clients entièrement déductiblesImpôts - TVA, Impôt des sociétésLe fisc accepte que la location de places de parking soit entièrement déductible pour autant que celles-ci servent à vos clients et fournisseurs.12.04.2024",https://compta.webwin.be/newsletter-by-email/places-de-parking-pour-vos-clients-entierement-deductibles
"Une borne de recharge ne conduit pas un revenu cadastral plus élevéImpôt des sociétésSi la valeur locative d'un bâtiment augmente sensiblement en raison de travaux (plus de 50€ ou 15% du revenu cadastral (RC) existant), cela a pour conséquence un RC plus élevé et donc aussi un précompte immobilier plus élevé.10.04.2024",https://compta.webwin.be/new-flashes/une-borne-de-recharge-ne-conduit-pas-un-revenu-cadastral-plus-eleve
"Enlever une cuve à mazout moyennant 6% de TVA?Impôts - TVAEn principe, l'enlèvement d'une cuve à mazout n'est pas un travail immobilier en matière de TVA et ne peut pas donc bénéficier du taux réduit de 6% de TVA.10.04.2024",https://compta.webwin.be/newsletter-by-email/supprimer-une-cuve-a-mazout-moyennant-6-de-tva
"Pas d'IPP sur les dividendes jusqu'à 800€Impôts des personnes physiquesEn principe, un dividende est soumis à 30% de précompte mobilier à retenir de la distribution de celui-ci.05.04.2024",https://compta.webwin.be/new-flashes/pas-dipp-sur-les-dividendes-jusqua-800
Déclaration Reprobel pour l'année 2023 à déposer en ligne pour le 30.04.2024Reprobel est l'organisation qui perçoit la redevance que les utilisateurs professionnels doivent payer pour la réutilisation numérique et la reproduction sur papier de textes et d’images protégés par le droit d’auteur.05.04.2024,https://compta.webwin.be/newsletter-by-email/declaration-reprobel-pour-lannee-2023-a-deposer-en-ligne-pour-le-30042024
"Les critères de ""petite"" et ""micro"" société ont été modifiésImpôt des sociétésPour les exercices comptables qui débutent à partir du 1er janvier 2024, les critères de taille (art. 1:24 CSA) ont été modifiés.03.04.2024",https://compta.webwin.be/new-flashes/les-criteres-de-petite-et-micro-societe-ont-ete-modifies
"10.04.2024: première échéance pour les versements anticipésImpôt des sociétés, Impôts des personnes physiquesLes versements anticipés sont une avance sur l'IPP ou l'ISoc finalement dû.03.04.2024",https://compta.webwin.be/newsletter-by-email/10042024-premiere-echeance-pour-les-versements-anticipes
"Une voiture comme versement de la réserve de liquidation ?Impôt des sociétésVotre SRL possède une voiture que vous souhaitez vous approprier à titre privé. Vous pouvez le faire en procédant à la distribution en nature d’une réserve de liquidation. Mais qu’en est-il alors de l’ISoc, du Pr M et de la TVA ? Regardons.02.04.2024",https://compta.webwin.be/tax-dosier-of-the-month/une-voiture-comme-versement-de-la-reserve-de-liquidation
"Reprendre l'intégralité de votre sponsoring en fraisImpôt des sociétés, Impôts des personnes physiquesIl est question de sponsoring lorsque l'organisation que vous sponsorisez vous donne l'occasion de faire de la publicité pour votre entreprise en échange de votre soutien.29.03.2024",https://compta.webwin.be/new-flashes/reprendre-lintegralite-de-votre-sponsoring-en-frais
